{
  "compiler": {
    "name": "harnessmith",
    "version": "0.1.0"
  },
  "files": {
    "SKILL.md": "171beb3dd6fabca675de5e579b0bf4f58eb79a6c13bc902b6ad55eec6e58bfea",
    "references/4-detection-passes-token-efficient-analysis.md": "f500bf5c8cbde99fdd694c5d87eb3eef8c27c3cd1ef87ab748bbb99eeb1a54d9",
    "references/extension-hooks-fallback.md": "3f2723c83844ea159bd1c70f4765960d6c2c91038eaf97ec2ac8e33c48f906ae",
    "references/specification-analysis-report.md": "6bbba1c15259547b2c99c47af86b409c0118af92969567a1aa60ce792465f3b7",
    "scripts/resolve-extension-hooks.py": "f89dcc4211f43cfb0ff47bc8388c32d8a2ab946454397420f743d9410e91238c"
  },
  "metrics": {
    "compiled_root_chars": 6416,
    "compiled_root_token_estimate": 1604,
    "conditional_reference_chars": 4703,
    "conditional_reference_token_estimate": 1176,
    "mandatory_reference_chars": 3331,
    "mandatory_reference_token_estimate": 833,
    "normal_path_instruction_chars": 9747,
    "normal_path_instruction_token_estimate": 2437,
    "normal_path_reduction_percent": 21,
    "packaged_instruction_chars": 14450,
    "packaged_instruction_token_estimate": 3613,
    "reference_chars": 8034,
    "reference_token_estimate": 2009,
    "root_char_reduction": 5847,
    "root_reduction_percent": 48,
    "script_chars": 10139,
    "script_token_estimate": 2535,
    "source_skill_chars": 12263,
    "source_skill_token_estimate": 3066
  },
  "recipe": {
    "path": "recipes/speckit-analyze.cursor.json",
    "sha256": "31a6f5e15e81590fb26c0c59c5bb46b43e48ba71318b4b5c4211b07e638f7af7"
  },
  "schema_version": 1,
  "source": {
    "path": "skills/speckit-analyze/SKILL.md",
    "sha256": "ca1df50efb37ef8364f717adc7da1723466d4286cce27e58e7fd5ed4c789d533"
  },
  "target": "cursor",
  "transformations": [
    {
      "dropped": [
        "argument-hint",
        "user-invocable"
      ],
      "reason": "not supported by target; defaults or presentation-only metadata preserved behavior",
      "type": "frontmatter-filter"
    },
    {
      "heading": "4. Detection Passes (Token-Efficient Analysis)",
      "output": "references/4-detection-passes-token-efficient-analysis.md",
      "section_id": "4. Detection Passes (Token-Efficient Analysis)[1]",
      "source_lines": [
        125,
        162
      ],
      "source_sha256": "7aa5bafaea9b7bbff97fb872e5198bb6becac70393b66a1c3bc064dfc3c1e8f5",
      "type": "extract-section"
    },
    {
      "heading": "Specification Analysis Report",
      "output": "references/specification-analysis-report.md",
      "section_id": "Specification Analysis Report[1]",
      "source_lines": [
        176,
        251
      ],
      "source_sha256": "1b52ad62b44ddadde5f02356dba4af886d606334e417cf14c2c02d231c2eb900",
      "type": "extract-section"
    },
    {
      "event": "before_analyze",
      "fallback": "references/extension-hooks-fallback.md",
      "output": "SKILL.md",
      "phase": "before",
      "replacement_sha256": "1c2e3b5b58401df7729d2540e4b192270fc24bf2a9d4bc088ee1801e4df7cfc0",
      "script": "scripts/resolve-extension-hooks.py",
      "source_heading": "Pre-Execution Checks",
      "source_lines": [
        21,
        61
      ],
      "source_sha256": "33f35bd94954558c4fd807701c62c05e47a6a63d0ce64a73f0e0ce9469a96048",
      "type": "resolve-extension-hooks"
    },
    {
      "event": "after_analyze",
      "fallback": "references/extension-hooks-fallback.md",
      "output": "references/specification-analysis-report.md",
      "phase": "after",
      "replacement_sha256": "b1325aea27121f3e67adfd635fcd2364b42c9a60da0abe2a683bfad19136dc48",
      "script": "scripts/resolve-extension-hooks.py",
      "source_heading": "9. Check for extension hooks",
      "source_lines": [
        214,
        251
      ],
      "source_sha256": "9a49c1187b6240b7e4349d246dab18a1ba59aa4442252f37cb76856c2261a520",
      "type": "resolve-extension-hooks"
    }
  ]
}
